{
  "rows": 40,
  "cols": 120,
  "grid": [
    "breadboard — interactive session                                                                                        ",
    "                                (pending) ● Finished ● model openrouter/x-ai/grok-4-fast ○ local ○ events 0 ● tools 2   ",
    "                                                                                                                        ",
    "                                                                                                                        ",
    "                                                                                                                     ● P",
    "atch(hello.c)                                                                                                           ",
    "               │ - printf(\"hello world\\n\");                                                                             ",
    "                                             └ + printf(\"goodbye world\\n\");                                             ",
    "                                                                           ● Tool: running                              ",
    "                                                                                                                        ",
    "                                                                                                                        ",
    "                                                                                                                        ",
    "                                                                                                                        ",
    "                                                                                                                        ",
    "                                                                                                                        ",
    "                                                                                                                        ",
    "                                                                                                                        ",
    "                                                                                                                        ",
    "                                                                                                                        ",
    "                                                                                                                        ",
    "                                                                                                                        ",
    "                                                                                                                        ",
    "                                                                                                                        ",
    "                                                                                                                        ",
    "                                                                                                                        ",
    "                                                                                                                        ",
    "                                                                                                                        ",
    "                                                                                                                        ",
    "                                                                                                                        ",
    "                                                                                                                        ",
    "                                                                                                                        ",
    "                                                                                                                        ",
    "                                                                                                                        ",
    "                                                                                                                        ",
    "                                                                                                                        ",
    "                                                                                                                        ",
    "                                                                                                                        ",
    "                                                                                                                        ",
    "                                                                                                                        ",
    "                                                                                                                        "
  ],
  "activeBuffer": "normal",
  "normalGrid": [
    "breadboard — interactive session                                                                                        ",
    "                                (pending) ● Finished ● model openrouter/x-ai/grok-4-fast ○ local ○ events 0 ● tools 2   ",
    "                                                                                                                        ",
    "                                                                                                                        ",
    "                                                                                                                     ● P",
    "atch(hello.c)                                                                                                           ",
    "               │ - printf(\"hello world\\n\");                                                                             ",
    "                                             └ + printf(\"goodbye world\\n\");                                             ",
    "                                                                           ● Tool: running                              ",
    "                                                                                                                        ",
    "                                                                                                                        ",
    "                                                                                                                        ",
    "                                                                                                                        ",
    "                                                                                                                        ",
    "                                                                                                                        ",
    "                                                                                                                        ",
    "                                                                                                                        ",
    "                                                                                                                        ",
    "                                                                                                                        ",
    "                                                                                                                        ",
    "                                                                                                                        ",
    "                                                                                                                        ",
    "                                                                                                                        ",
    "                                                                                                                        ",
    "                                                                                                                        ",
    "                                                                                                                        ",
    "                                                                                                                        ",
    "                                                                                                                        ",
    "                                                                                                                        ",
    "                                                                                                                        ",
    "                                                                                                                        ",
    "                                                                                                                        ",
    "                                                                                                                        ",
    "                                                                                                                        ",
    "                                                                                                                        ",
    "                                                                                                                        ",
    "                                                                                                                        ",